{
  "schemaVersion": 1,
  "generatedAt": "<generated-at>",
  "toolVersion": "<tool-version>",
  "repository": {
    "name": "binary",
    "defaultBranch": "main",
    "headCommit": "e903db7ce267ffd32d911bd1a61fb7df3bacad98",
    "firstCommit": "2025-10-01T00:00:00Z",
    "lastCommit": "2025-10-04T00:00:00Z",
    "ageDays": 4,
    "commitsTotal": 3,
    "commitsAnalyzed": 3,
    "commitsExcluded": {
      "merges": 0,
      "bots": 0,
      "total": 0
    },
    "contributors": 1,
    "trackedFiles": 4,
    "trackedLines": 4,
    "isShallow": false
  },
  "temporal": {
    "hourHistogram": [
      3,
      0,
      0,
      0,
      0,
      0,
      0,
      0,
      0,
      0,
      0,
      0,
      0,
      0,
      0,
      0,
      0,
      0,
      0,
      0,
      0,
      0,
      0,
      0
    ],
    "weekdayHistogram": [
      0,
      0,
      1,
      0,
      1,
      1,
      0
    ],
    "hourWeekdayGrid": [
      [
        0,
        0,
        0,
        0,
        0,
        0,
        0,
        0,
        0,
        0,
        0,
        0,
        0,
        0,
        0,
        0,
        0,
        0,
        0,
        0,
        0,
        0,
        0,
        0
      ],
      [
        0,
        0,
        0,
        0,
        0,
        0,
        0,
        0,
        0,
        0,
        0,
        0,
        0,
        0,
        0,
        0,
        0,
        0,
        0,
        0,
        0,
        0,
        0,
        0
      ],
      [
        1,
        0,
        0,
        0,
        0,
        0,
        0,
        0,
        0,
        0,
        0,
        0,
        0,
        0,
        0,
        0,
        0,
        0,
        0,
        0,
        0,
        0,
        0,
        0
      ],
      [
        0,
        0,
        0,
        0,
        0,
        0,
        0,
        0,
        0,
        0,
        0,
        0,
        0,
        0,
        0,
        0,
        0,
        0,
        0,
        0,
        0,
        0,
        0,
        0
      ],
      [
        1,
        0,
        0,
        0,
        0,
        0,
        0,
        0,
        0,
        0,
        0,
        0,
        0,
        0,
        0,
        0,
        0,
        0,
        0,
        0,
        0,
        0,
        0,
        0
      ],
      [
        1,
        0,
        0,
        0,
        0,
        0,
        0,
        0,
        0,
        0,
        0,
        0,
        0,
        0,
        0,
        0,
        0,
        0,
        0,
        0,
        0,
        0,
        0,
        0
      ],
      [
        0,
        0,
        0,
        0,
        0,
        0,
        0,
        0,
        0,
        0,
        0,
        0,
        0,
        0,
        0,
        0,
        0,
        0,
        0,
        0,
        0,
        0,
        0,
        0
      ]
    ],
    "braveDeploys": 0,
    "nightOwlRatio": 1,
    "busiestDay": {
      "date": "2025-10-01",
      "count": 1
    },
    "longestStreak": {
      "days": 2,
      "startDate": "2025-10-03",
      "endDate": "2025-10-04"
    },
    "longestSilence": {
      "days": 2,
      "startDate": "2025-10-01",
      "endDate": "2025-10-03"
    },
    "commitsPerMonth": [
      {
        "month": "2025-10",
        "count": 3
      }
    ],
    "firstCommit": "2025-10-01T00:00:00Z",
    "lastCommit": "2025-10-04T00:00:00Z"
  },
  "code": {
    "mostTouchedFiles": [
      {
        "path": "logo.png",
        "commits": 2,
        "added": 0,
        "deleted": 0,
        "deletedFromHead": false
      },
      {
        "path": "readme.txt",
        "commits": 2,
        "added": 2,
        "deleted": 0,
        "deletedFromHead": false
      },
      {
        "path": "assets/a file with spaces.txt",
        "commits": 1,
        "added": 1,
        "deleted": 0,
        "deletedFromHead": false
      },
      {
        "path": "assets/ünïcödé-ファイル.txt",
        "commits": 1,
        "added": 1,
        "deleted": 0,
        "deletedFromHead": false
      }
    ],
    "largestCommit": {
      "hash": "011f69299a56da74502f67408113be4d6ff3a0f8",
      "subject": "feat: add assets",
      "date": "2025-10-01T00:00:00Z",
      "linesChanged": 3,
      "added": 3,
      "deleted": 0,
      "files": 4
    },
    "averageCommitSize": 1.3,
    "medianCommitSize": 1,
    "totalAdded": 4,
    "totalDeleted": 0,
    "oldestUntouchedFile": {
      "path": "assets/a file with spaces.txt",
      "lastModified": "2025-10-01T00:00:00Z"
    },
    "fileTypeDistribution": [
      {
        "extension": "txt",
        "changes": 4,
        "added": 4,
        "deleted": 0
      },
      {
        "extension": "png",
        "changes": 2,
        "added": 0,
        "deleted": 0
      }
    ],
    "codeAge": [
      {
        "year": 2025,
        "lines": 4
      }
    ],
    "survivingFromFirstYear": 1,
    "codeAgeSampledFiles": 3,
    "codeAgeTotalFiles": 3,
    "trackedFiles": 4,
    "trackedLines": 4
  },
  "messages": {
    "typeDistribution": {
      "chore": 1,
      "feat": 1,
      "fix": 1
    },
    "conventionalRatio": 1,
    "lowConfidence": false,
    "shortMessages": 0,
    "longestSubject": {
      "hash": "e903db7ce267ffd32d911bd1a61fb7df3bacad98",
      "length": 41,
      "subject": "fix: strip \u003c/script\u003e tags from user input"
    },
    "averageSubjectLength": 25,
    "emojiCommits": 0,
    "topEmoji": [],
    "revertCount": 0,
    "typoFixCount": 0,
    "topWords": [
      {
        "word": "assets",
        "count": 1
      },
      {
        "word": "chore",
        "count": 1
      },
      {
        "word": "feat",
        "count": 1
      },
      {
        "word": "input",
        "count": 1
      },
      {
        "word": "logo",
        "count": 1
      },
      {
        "word": "script",
        "count": 1
      },
      {
        "word": "strip",
        "count": 1
      },
      {
        "word": "tags",
        "count": 1
      },
      {
        "word": "user",
        "count": 1
      }
    ]
  },
  "social": {
    "busFactor": 1,
    "directoryBusFactor": [],
    "coupling": [],
    "churn": [],
    "knowledgeConcentration": []
  },
  "notables": {
    "bulkCommits": [],
    "latestNightCommit": {
      "hash": "e903db7ce267ffd32d911bd1a61fb7df3bacad98",
      "subject": "fix: strip \u003c/script\u003e tags from user input",
      "date": "2025-10-04T00:00:00Z",
      "linesChanged": 1,
      "added": 1,
      "deleted": 0,
      "files": 1
    },
    "earliestMorningCommit": null,
    "weekendRatio": 0.3333,
    "holidayCommits": 0,
    "firstCommitSubject": "feat: add assets",
    "mergeCount": 0,
    "timezoneSpread": [
      {
        "offsetMinutes": 0,
        "commits": 3
      }
    ]
  },
  "warnings": []
}
